{
  "$schema": "https://json-schema.org/draft/2020-12/schema",
  "$id": "https://github.com/wave-rf/chtypes/spec/abi-v2/schema/abi.schema.json",
  "title": "chtypes ABI description, format 2",
  "description": "The shape of spec/abi-v2/abi.json: format 1 (spec/abi-v1/schema/abi.schema.json) plus the top-level `stability`, the top-level `inputs` (the closed input documents a growable function takes, rule r1 in spec/abi-v2/docs.md) and a function's `growable`, and `abi` pinned to 2. Structure only: cross-references (a handle's free function exists, a status is a chs_status value, a FIRM function names nothing provisional, docs.md covers every symbol) are checked by scripts/abi-v1/model.py. Uses only the keywords that validator implements; it refuses any other.",
  "type": "object",
  "additionalProperties": false,
  "required": ["description_schema", "abi", "stability", "library", "scalars", "handles", "enums", "constants", "byte_strings", "documents", "build_info", "functions"],
  "properties": {
    "description_schema": {"const": 2, "description": "The version of this format."},
    "abi": {"const": 2, "description": "The ABI generation: CHS_ABI_VERSION, and what chs_abi_version() returns. This description is generation 2's."},
    "stability": {"enum": ["unstable", "locked"], "description": "unstable: the description is still being designed and its fingerprint moves with every change, so only pre-release SDKs speak it. locked: frozen, the fingerprint is fixed, and the generation ships. Inside the fingerprint, so the lock moves it one last time and no unstable build is ever accepted as a locked one."},
    "library": {
      "type": "object",
      "additionalProperties": false,
      "required": ["stem", "prefix"],
      "properties": {
        "stem": {"const": "libchtypes", "description": "Frozen (D1.3)."},
        "prefix": {"const": "chs_", "description": "Frozen (D1.3): nothing else is exported."}
      }
    },
    "scalars": {
      "type": "array",
      "uniqueItems": true,
      "items": {"$ref": "#/$defs/scalar"}
    },
    "handles": {
      "type": "object",
      "propertyNames": {"$ref": "#/$defs/c_type_name"},
      "additionalProperties": {"$ref": "#/$defs/handle"}
    },
    "enums": {
      "type": "object",
      "propertyNames": {"pattern": "^[a-z][a-z0-9_]*$"},
      "additionalProperties": {"oneOf": [{"$ref": "#/$defs/int_enum"}, {"$ref": "#/$defs/string_enum"}]}
    },
    "constants": {
      "type": "object",
      "propertyNames": {"pattern": "^CHS_[A-Z0-9_]+$"},
      "additionalProperties": {"$ref": "#/$defs/constant"}
    },
    "byte_strings": {
      "type": "object",
      "additionalProperties": false,
      "required": ["suffix", "encoding", "value"],
      "description": "The one rule for every data-derived string a JSON document carries (a column name included), in every output document and in the input column list: the member F is a JSON string when the bytes are valid UTF-8 (a NUL written as an escape), and otherwise the member F + suffix holds the raw bytes in `encoding` (standard base64, padded). Never both. Where a document would hold a bare data-derived string in an array or as an object key, it holds an object instead, so the rule applies to that object's members. `value` names the member that holds a scalar String or FixedString value's raw bytes, beside its rendering. Each document lists its data-derived fields in byte_fields and the entries that carry `value` in value_entries; scripts/abi-v1/model.py checks both against the document's schema.",
      "properties": {
        "suffix": {"const": "_b64"},
        "encoding": {"enum": ["base64"]},
        "value": {"$ref": "#/$defs/c_ident"}
      }
    },
    "documents": {
      "type": "object",
      "propertyNames": {"pattern": "^[a-z][a-z0-9_]*$"},
      "additionalProperties": {"$ref": "#/$defs/document"}
    },
    "inputs": {
      "type": "object",
      "description": "The input documents: JSON objects a caller passes in a bytes_in parameter whose content is input:<name>. The library refuses a key a document does not define (rule r1), so each schema closes every object; scripts/abi-v1/model.py checks that and r1's shape.",
      "propertyNames": {"pattern": "^[a-z][a-z0-9_]*$"},
      "additionalProperties": {"$ref": "#/$defs/input"}
    },
    "build_info": {
      "type": "object",
      "additionalProperties": false,
      "required": ["schema"],
      "properties": {
        "schema": {"type": "object", "description": "A JSON Schema (the subset model.py implements) of the object chs_build_info() returns (D4)."},
        "provisional_fields": {
          "type": "object",
          "description": "build_info properties whose CONTENT is provisional, though the field itself is FIRM.",
          "additionalProperties": {"$ref": "#/$defs/markers"}
        }
      }
    },
    "functions": {
      "type": "array",
      "minItems": 1,
      "items": {"$ref": "#/$defs/function"}
    }
  },
  "$defs": {
    "c_type_name": {"type": "string", "pattern": "^chs_[a-z0-9_]+$"},
    "c_ident": {"type": "string", "pattern": "^[a-z][a-z0-9_]*$"},
    "doc_path": {"type": "string", "pattern": "^[a-z][a-z0-9_]*(\\[\\])*([.][a-z][a-z0-9_]*(\\[\\])*)*$"},
    "markers": {
      "description": "Present = PROVISIONAL, waiting on each named marker (sdk.json provisional_markers has the legend). Absent = FIRM.",
      "type": "array",
      "minItems": 1,
      "uniqueItems": true,
      "items": {"type": "string", "pattern": "^(A[0-9]+|Q-[a-z]|confirm)$"}
    },
    "scalar": {"enum": ["void", "int", "int32", "uint32", "int64", "uint64", "size", "u8ptr_const", "cstr_static"]},
    "content": {
      "description": "What a counted byte string carries. Every one is a byte string, never a C string: NUL and invalid UTF-8 pass through. A document:<name> content names an entry in documents, and an input:<name> content an entry in inputs.",
      "type": "string",
      "pattern": "^(bytes|name|sql|message|ascii|json_object_string_values|json_object_byte_values|json_array_names|timezone|document:[a-z][a-z0-9_]*|input:[a-z][a-z0-9_]*)$"
    },
    "handle": {
      "type": "object",
      "additionalProperties": false,
      "required": ["free", "holds"],
      "properties": {
        "free": {"$ref": "#/$defs/c_type_name"},
        "holds": {"type": "array", "uniqueItems": true, "items": {"$ref": "#/$defs/c_type_name"}},
        "provisional": {"$ref": "#/$defs/markers"}
      }
    },
    "int_enum": {
      "type": "object",
      "additionalProperties": false,
      "required": ["repr", "values"],
      "properties": {
        "repr": {"const": "int32"},
        "closed": {"type": "boolean", "description": "No value may be added within this ABI generation."},
        "frozen": {"type": "boolean", "description": "No value may be renumbered or removed."},
        "fields": {"$ref": "#/$defs/value_fields"},
        "fallback": {"type": "string"},
        "provisional": {"$ref": "#/$defs/markers"},
        "values": {
          "type": "array",
          "minItems": 1,
          "items": {
            "type": "object",
            "required": ["name", "value"],
            "propertyNames": {"pattern": "^[a-z][a-z0-9_]*$"},
            "properties": {
              "name": {"type": "string", "pattern": "^CHS_[A-Z0-9_]+$"},
              "value": {"type": "integer", "minimum": -2147483648, "maximum": 2147483647}
            }
          }
        }
      }
    },
    "string_enum": {
      "description": "A document vocabulary: the strings a JSON document carries, with per-value facts a binding reads instead of deriving.",
      "type": "object",
      "additionalProperties": false,
      "required": ["repr", "values"],
      "properties": {
        "repr": {"const": "string"},
        "closed": {"type": "boolean"},
        "frozen": {"type": "boolean"},
        "fields": {"$ref": "#/$defs/value_fields"},
        "fallback": {"type": "string", "description": "The value whose per-value facts and answers an unrecognized spelling's unknown(n) member reports (rule r3 in spec/abi-v2/docs.md): the fail-closed arm. A reader keeps the raw value; it never reads it as this value."},
        "provisional": {"$ref": "#/$defs/markers"},
        "values": {
          "type": "array",
          "minItems": 1,
          "items": {
            "type": "object",
            "required": ["value"],
            "propertyNames": {"pattern": "^[a-z][a-z0-9_]*$"},
            "properties": {
              "value": {"type": "string", "pattern": "^([A-Za-z0-9_]+(-[A-Za-z0-9_]+)*)?$", "description": "The exact string a document carries: ASCII letters, digits and underscores, with a single hyphen allowed between two words, and possibly empty (ClickHouse's own spellings, such as a default kind, are kept as ClickHouse spells them, and a WHERE-settings tier as the artifact producer's lists spell it, such as predicate-unflipped). Every binding spells a hyphen as a word boundary in its identifiers."}
            }
          }
        }
      }
    },
    "value_fields": {
      "type": "object",
      "propertyNames": {"pattern": "^[a-z][a-z0-9_]*$"},
      "additionalProperties": {"enum": ["string", "boolean", "integer"]}
    },
    "constant": {
      "type": "object",
      "additionalProperties": false,
      "required": ["type", "value"],
      "properties": {
        "type": {"enum": ["int32", "uint32", "int64", "uint64"]},
        "value": {"type": "integer"},
        "provisional": {"$ref": "#/$defs/markers"}
      }
    },
    "document": {
      "type": "object",
      "additionalProperties": false,
      "required": ["carries_names"],
      "properties": {
        "carries_names": {"type": "boolean", "description": "The document carries column names, which are byte strings, each carried as byte_strings says."},
        "byte_fields": {
          "type": "array",
          "uniqueItems": true,
          "items": {"$ref": "#/$defs/doc_path"},
          "description": "Every data-derived string field of the document, as a path into it: members joined by `.`, and `[]` after a member for each array level. Each is carried by the byte_strings rule."
        },
        "value_entries": {
          "type": "array",
          "uniqueItems": true,
          "items": {"$ref": "#/$defs/doc_path"},
          "description": "The entries (paths ending in `[]`) that report a stored value: each carries the byte_strings `value` member for a scalar String or FixedString value."
        },
        "schema": {"type": "object", "description": "A JSON Schema (the subset model.py implements) of the fields of the document that the description fixes; a document may carry more, as docs.md describes."},
        "provisional": {"$ref": "#/$defs/markers"}
      }
    },
    "input": {
      "type": "object",
      "additionalProperties": false,
      "required": ["options", "schema"],
      "properties": {
        "options": {"type": "boolean", "description": "true: an options document, the one input a growable function takes the inputs it gains in (rule r1), so a later option is a new member here, never a new parameter. false: an input document of fixed purpose (a server profile), which a function may take beside its options document."},
        "schema": {"type": "object", "description": "A JSON Schema (the subset model.py implements) of the document. It closes every object: `additionalProperties: false` on a record, or an `additionalProperties` schema and no `properties` on a map whose keys are data, such as setting or macro names."}
      }
    },
    "function": {
      "type": "object",
      "additionalProperties": false,
      "required": ["name", "class", "thread", "init", "returns", "params"],
      "properties": {
        "name": {"$ref": "#/$defs/c_type_name"},
        "class": {"enum": ["handshake", "tombstone", "api", "tooling"]},
        "thread": {"enum": ["any", "shared", "handle_serial", "process_once", "process_serial"], "description": "The thread class; scripts/abi-v1/model.py THREADS describes each, and load() ties it to the function's shape: `shared` exactly when the call reads a caller handle and is not a free, `handle_serial` exactly for a free."},
        "init": {"enum": ["any", "required"], "description": "The init class: whether the call is valid before `chs_initialize` has succeeded (the Preamble's Initialization in docs.md). scripts/abi-v1/model.py INITS describes each, and load() ties it to the function: `any` for the handshake, the tombstone, `chs_initialize` and every call that returns no `chs_status` (the buffer and error accessors, the frees, `chs_shutdown`); `required` for every other call, unless its own docs.md section says it is valid before `chs_initialize`."},
        "provisional": {"$ref": "#/$defs/markers"},
        "growable": {"type": "boolean", "description": "Rule r1 in spec/abi-v2/docs.md: true marks a function that may gain inputs after it first ships. It takes exactly one options document (a bytes_in parameter whose content names an inputs entry with options true), and a function not marked growable takes no input document at all; scripts/abi-v1/model.py checks both."},
        "returns": {"$ref": "#/$defs/return"},
        "may_return": {
          "type": "array",
          "minItems": 1,
          "uniqueItems": true,
          "items": {"type": "string", "pattern": "^CHS_[A-Z_]+$"}
        },
        "params": {"type": "array", "items": {"$ref": "#/$defs/param"}}
      }
    },
    "return": {
      "oneOf": [
        {
          "type": "object", "additionalProperties": false, "required": ["kind"],
          "properties": {"kind": {"enum": ["status", "void"]}}
        },
        {
          "type": "object", "additionalProperties": false, "required": ["kind", "type"],
          "properties": {
            "kind": {"const": "scalar"},
            "type": {"$ref": "#/$defs/scalar"},
            "borrows": {"$ref": "#/$defs/c_ident"},
            "constant": {"type": "string", "pattern": "^CHS_[A-Z0-9_]+$"}
          }
        },
        {
          "type": "object", "additionalProperties": false, "required": ["kind", "type"],
          "properties": {"kind": {"const": "enum"}, "type": {"$ref": "#/$defs/c_ident"}}
        },
        {
          "type": "object", "additionalProperties": false, "required": ["kind", "type", "owned"],
          "properties": {
            "kind": {"const": "handle"},
            "type": {"$ref": "#/$defs/c_type_name"},
            "owned": {"const": true},
            "nullable": {"type": "boolean"},
            "content": {"$ref": "#/$defs/content"}
          }
        }
      ]
    },
    "param": {
      "oneOf": [
        {
          "type": "object", "additionalProperties": false, "required": ["name", "kind", "type"],
          "properties": {
            "name": {"$ref": "#/$defs/c_ident"},
            "kind": {"enum": ["scalar", "out_scalar"]},
            "type": {"$ref": "#/$defs/scalar"}
          }
        },
        {
          "type": "object", "additionalProperties": false, "required": ["name", "kind", "type"],
          "properties": {
            "name": {"$ref": "#/$defs/c_ident"},
            "kind": {"const": "enum"},
            "type": {"$ref": "#/$defs/c_ident"}
          }
        },
        {
          "type": "object", "additionalProperties": false, "required": ["name", "kind", "content"],
          "properties": {
            "name": {"$ref": "#/$defs/c_ident"},
            "kind": {"const": "bytes_in"},
            "content": {"$ref": "#/$defs/content"}
          }
        },
        {
          "type": "object", "additionalProperties": false, "required": ["name", "kind", "type"],
          "properties": {
            "name": {"$ref": "#/$defs/c_ident"},
            "kind": {"const": "handle"},
            "type": {"$ref": "#/$defs/c_type_name"},
            "const": {"type": "boolean"},
            "nullable": {"type": "boolean"}
          }
        },
        {
          "type": "object", "additionalProperties": false, "required": ["name", "kind", "type"],
          "properties": {
            "name": {"$ref": "#/$defs/c_ident"},
            "kind": {"const": "out_handle"},
            "type": {"$ref": "#/$defs/c_type_name"},
            "nullable": {"type": "boolean"},
            "content": {"$ref": "#/$defs/content"}
          }
        },
        {
          "type": "object", "additionalProperties": false, "required": ["name", "kind"],
          "properties": {
            "name": {"$ref": "#/$defs/c_ident"},
            "kind": {"const": "out_error"}
          }
        }
      ]
    }
  }
}
