{
  "description_schema": 2,
  "abi": 2,
  "stability": "locked",
  "library": {
    "stem": "libchtypes",
    "prefix": "chs_"
  },
  "scalars": [
    "void",
    "int",
    "int32",
    "uint32",
    "int64",
    "uint64",
    "size",
    "u8ptr_const",
    "cstr_static"
  ],
  "handles": {
    "chs_buf": {
      "free": "chs_buf_free",
      "holds": []
    },
    "chs_error": {
      "free": "chs_error_free",
      "holds": []
    },
    "chs_server": {
      "free": "chs_server_free",
      "holds": []
    },
    "chs_schema": {
      "free": "chs_schema_free",
      "holds": [
        "chs_server"
      ]
    },
    "chs_filter": {
      "free": "chs_filter_free",
      "holds": [
        "chs_schema"
      ]
    },
    "chs_block": {
      "free": "chs_block_free",
      "holds": [
        "chs_schema"
      ]
    }
  },
  "enums": {
    "chs_status": {
      "repr": "int32",
      "closed": true,
      "frozen": true,
      "values": [
        {
          "name": "CHS_OK",
          "value": 0
        },
        {
          "name": "CHS_REJECTED",
          "value": 1
        },
        {
          "name": "CHS_DECLINED",
          "value": 2
        },
        {
          "name": "CHS_INVALID_ARGUMENT",
          "value": 3
        },
        {
          "name": "CHS_INTERNAL",
          "value": 4
        }
      ]
    },
    "chs_format": {
      "repr": "int32",
      "frozen": true,
      "fields": {
        "ch_name": "string"
      },
      "values": [
        {
          "name": "CHS_JSON_EACH_ROW",
          "value": 0,
          "ch_name": "JSONEachRow"
        },
        {
          "name": "CHS_CSV",
          "value": 1,
          "ch_name": "CSV"
        },
        {
          "name": "CHS_TSV",
          "value": 2,
          "ch_name": "TSV"
        },
        {
          "name": "CHS_VALUES",
          "value": 3,
          "ch_name": "Values"
        },
        {
          "name": "CHS_JSON_COMPACT_EACH_ROW",
          "value": 4,
          "ch_name": "JSONCompactEachRow"
        },
        {
          "name": "CHS_ROW_BINARY",
          "value": 5,
          "ch_name": "RowBinary"
        },
        {
          "name": "CHS_ROW_BINARY_WITH_DEFAULTS",
          "value": 6,
          "ch_name": "RowBinaryWithDefaults"
        },
        {
          "name": "CHS_ROW_BINARY_WITH_NAMES_AND_TYPES_AND_DEFAULTS",
          "value": 7,
          "ch_name": "RowBinaryWithNamesAndTypesAndDefaults"
        },
        {
          "name": "CHS_NATIVE",
          "value": 8,
          "ch_name": "Native"
        },
        {
          "name": "CHS_BUFFERS",
          "value": 9,
          "ch_name": "Buffers"
        },
        {
          "name": "CHS_CSV_WITH_NAMES",
          "value": 10,
          "ch_name": "CSVWithNames"
        },
        {
          "name": "CHS_TSV_WITH_NAMES",
          "value": 11,
          "ch_name": "TSVWithNames"
        }
      ]
    },
    "transform_reason": {
      "repr": "string",
      "fields": {
        "lossy": "boolean"
      },
      "fallback": "value_changed",
      "values": [
        {
          "value": "overflow_wrap",
          "lossy": true
        },
        {
          "value": "null_to_default",
          "lossy": true
        },
        {
          "value": "null_loss",
          "lossy": true
        },
        {
          "value": "decimal_truncate",
          "lossy": true
        },
        {
          "value": "date_clamp",
          "lossy": true
        },
        {
          "value": "datetime_wrap",
          "lossy": true
        },
        {
          "value": "date_shift",
          "lossy": true
        },
        {
          "value": "uuid_mangle",
          "lossy": true
        },
        {
          "value": "ip_mangle",
          "lossy": true
        },
        {
          "value": "float_precision",
          "lossy": true
        },
        {
          "value": "lossy_numeric",
          "lossy": true
        },
        {
          "value": "fixedstring_pad",
          "lossy": true
        },
        {
          "value": "emptied",
          "lossy": true
        },
        {
          "value": "element_changed",
          "lossy": true
        },
        {
          "value": "enum_coerce",
          "lossy": true
        },
        {
          "value": "value_changed",
          "lossy": true
        },
        {
          "value": "poisoned",
          "lossy": true
        },
        {
          "value": "duplicate_key_dropped",
          "lossy": true
        },
        {
          "value": "reformat",
          "lossy": false
        },
        {
          "value": "default_filled",
          "lossy": false
        },
        {
          "value": "zero_filled",
          "lossy": false
        },
        {
          "value": "default_materialized",
          "lossy": false
        },
        {
          "value": "ttl_expired",
          "lossy": true
        },
        {
          "value": "ttl_column_expired",
          "lossy": true
        }
      ]
    },
    "merge_reason": {
      "repr": "string",
      "values": [
        {
          "value": "ttl_delete"
        },
        {
          "value": "ttl_column_reset"
        }
      ]
    },
    "value_src": {
      "repr": "string",
      "fields": {
        "is_stored": "boolean"
      },
      "fallback": "skipped",
      "values": [
        {
          "value": "input",
          "is_stored": true
        },
        {
          "value": "default",
          "is_stored": true
        },
        {
          "value": "default_substituted",
          "is_stored": true
        },
        {
          "value": "default_generated",
          "is_stored": true
        },
        {
          "value": "absent",
          "is_stored": true
        },
        {
          "value": "materialized_input",
          "is_stored": true
        },
        {
          "value": "skipped",
          "is_stored": false
        },
        {
          "value": "ephemeral_input",
          "is_stored": false
        },
        {
          "value": "default_expr_unsupported",
          "is_stored": false
        },
        {
          "value": "default_volatile_unresolved",
          "is_stored": false
        },
        {
          "value": "default_pending",
          "is_stored": false
        },
        {
          "value": "default_deferred",
          "is_stored": false
        },
        {
          "value": "default_override",
          "is_stored": true
        }
      ]
    },
    "row_outcome": {
      "repr": "string",
      "fallback": "unsupported",
      "values": [
        {
          "value": "accepted"
        },
        {
          "value": "accepted_poisoned"
        },
        {
          "value": "rejected"
        },
        {
          "value": "skipped"
        },
        {
          "value": "unsupported"
        }
      ]
    },
    "batch_outcome": {
      "repr": "string",
      "fallback": "unsupported",
      "values": [
        {
          "value": "accepted"
        },
        {
          "value": "accepted_poisoned"
        },
        {
          "value": "rejected"
        },
        {
          "value": "unsupported"
        }
      ]
    },
    "filter_outcome": {
      "repr": "string",
      "fallback": "unsupported",
      "values": [
        {
          "value": "ok"
        },
        {
          "value": "rejected"
        },
        {
          "value": "unsupported"
        }
      ]
    },
    "filter_verdict": {
      "repr": "string",
      "fields": {
        "answered": "boolean"
      },
      "fallback": "d",
      "values": [
        {
          "value": "t",
          "answered": true
        },
        {
          "value": "f",
          "answered": true
        },
        {
          "value": "e",
          "answered": false
        },
        {
          "value": "d",
          "answered": false
        }
      ]
    },
    "refusal_site": {
      "repr": "string",
      "values": [
        {
          "value": "call"
        },
        {
          "value": "body_read"
        },
        {
          "value": "row"
        },
        {
          "value": "body_step"
        }
      ]
    },
    "discover_query_param": {
      "repr": "string",
      "fields": {
        "ch_type": "string"
      },
      "values": [
        {
          "value": "database",
          "ch_type": "String"
        },
        {
          "value": "table",
          "ch_type": "String"
        }
      ]
    },
    "default_kind": {
      "repr": "string",
      "values": [
        {
          "value": ""
        },
        {
          "value": "DEFAULT"
        },
        {
          "value": "MATERIALIZED"
        },
        {
          "value": "ALIAS"
        },
        {
          "value": "EPHEMERAL"
        }
      ]
    },
    "default_support": {
      "repr": "string",
      "values": [
        {
          "value": "computed"
        },
        {
          "value": "generated"
        },
        {
          "value": "deferred"
        },
        {
          "value": "declined"
        }
      ]
    },
    "declined_tier": {
      "repr": "string",
      "values": [
        {
          "value": "predicate"
        },
        {
          "value": "predicate-unflipped"
        },
        {
          "value": "result-content"
        },
        {
          "value": "server-refuses"
        }
      ]
    },
    "declined_layer": {
      "repr": "string",
      "values": [
        {
          "value": "defaults"
        },
        {
          "value": "server"
        },
        {
          "value": "schema"
        }
      ]
    },
    "posture": {
      "repr": "string",
      "values": [
        {
          "value": "create"
        },
        {
          "value": "load"
        }
      ]
    }
  },
  "constants": {
    "CHS_ABI_REVISION_TOMBSTONE": {
      "type": "int32",
      "value": 1001
    },
    "CHS_EXPORT_NONE": {
      "type": "int32",